,Unnamed: 0,Unnamed: 0.1,Unnamed: 0.1.1,Unnamed: 0.1.1.1,Unnamed: 0.1.1.1.1,Unnamed: 0.1.1.1.1.1,Unnamed: 0.1.1.1.1.1.1,id,filename,title,url,is_image
1,2,3,4,5,6,6,,13it59w,nature_is_feral/13it59w.mp4,This turtle has its own ecosystem,https://raw.githubusercontent.com/AryanSingh1995/collection/master/13it59w.mp4,True
2,3,4,5,6,7,7,,13j7wyn,nature_is_feral/13j7wyn.mp4,Just a parasitic mushroom growing out of a grasshopper,https://raw.githubusercontent.com/AryanSingh1995/collection/master/13j7wyn.mp4,True
3,4,5,6,7,8,8,,13lve3r,nature_is_feral/13lve3r.mp4,Falcon snatches Puffin mid air -,https://raw.githubusercontent.com/AryanSingh1995/collection/master/13lve3r.mp4,True
4,5,6,7,8,9,9,,13nf1cu,nature_is_feral/13nf1cu.mp4,after the battle,https://raw.githubusercontent.com/AryanSingh1995/collection/master/13nf1cu.mp4,True
5,6,7,8,9,10,10,,13ko7hi,nature_is_feral/13ko7hi.mp4,"Native Rakali,(Australians Water Rat), eating an invasive Cane Toad with surgical precision to avoid being poisoned. Native species have recently been fighting back against the cane toad invasion.",https://raw.githubusercontent.com/AryanSingh1995/collection/master/13ko7hi.mp4,True
6,7,8,9,10,11,11,,13mu3ec,nature_is_feral/13mu3ec.mp4,Bear with a foal hanging out of its mouth,https://raw.githubusercontent.com/AryanSingh1995/collection/master/13mu3ec.mp4,True
7,8,9,10,11,12,12,,13kovyh,nature_is_feral/13kovyh.mp4,Riddhi the Tigress with a Spotted deer in her jaws.,https://raw.githubusercontent.com/AryanSingh1995/collection/master/13kovyh.mp4,True
8,9,10,11,12,13,13,,13ko6ou,nature_is_feral/13ko6ou.mp4,The perfect moment in which the rising sun made this polar bear's backlit breath look like fire. (Josh Anon),https://raw.githubusercontent.com/AryanSingh1995/collection/master/13ko6ou.mp4,True
9,10,11,12,13,14,14,,13ixi2f,nature_is_feral/13ixi2f.mp4,Seal of Cthulhu,https://raw.githubusercontent.com/AryanSingh1995/collection/master/13ixi2f.mp4,True
10,11,12,13,14,15,15,,13m38ye,nature_is_feral/13m38ye.mp4,I would have never seen this spider unless it moved. It’s camouflage is insane,https://raw.githubusercontent.com/AryanSingh1995/collection/master/13m38ye.mp4,True
11,12,13,14,15,16,16,,13m5zwf,nature_is_feral/13m5zwf.mp4,Alligator has a soggy snack in South Carolina.,https://raw.githubusercontent.com/AryanSingh1995/collection/master/13m5zwf.mp4,True
12,13,14,15,16,17,17,,13k6in0,nature_is_feral/13k6in0.mp4,Deep blue largest great white recorded,https://raw.githubusercontent.com/AryanSingh1995/collection/master/13k6in0.mp4,True
13,14,15,16,17,18,18,,13izb4p,nature_is_feral/13izb4p.mp4,nature will reclaim us all,https://raw.githubusercontent.com/AryanSingh1995/collection/master/13izb4p.mp4,True
14,15,16,17,18,19,19,,13iod3q,nature_is_feral/13iod3q.mp4,"A ""zombie spider"" - spider covered in fungus, half-dead, half-alive which can crawl around. Found in /u/idrinkoxygen's basement.",https://raw.githubusercontent.com/AryanSingh1995/collection/master/13iod3q.mp4,True
15,16,17,18,19,20,20,,13iy7tq,nature_is_feral/13iy7tq.mp4,A Giant eland killed by a lion attracts a Hippo and a few hyenas.,https://raw.githubusercontent.com/AryanSingh1995/collection/master/13iy7tq.mp4,True
16,17,18,19,20,21,21,,13j5n3c,nature_is_feral/13j5n3c.mp4,A golden rod crab spider assassinating this honey bee,https://raw.githubusercontent.com/AryanSingh1995/collection/master/13j5n3c.mp4,True
17,18,19,20,21,22,22,,13ndoy6,nature_is_feral/13ndoy6.mp4,Prairie Kingsnake swallowing another snake,https://raw.githubusercontent.com/AryanSingh1995/collection/master/13ndoy6.mp4,True
18,19,20,21,22,23,23,,13mbq8h,nature_is_feral/13mbq8h.mp4,A bale of Painted Turtles basking on a common carp carcass,https://raw.githubusercontent.com/AryanSingh1995/collection/master/13mbq8h.mp4,True
